,type,name,Mitigation,url,Tactick_Id
0,course-of-action,Use Device-Provided Credential Storage,Application developers should use device-provided credential storage mechanisms such as Android's KeyStore or iOS's KeyChain. These can prevent credentials from being exposed to an adversary.,https://attack.mitre.org/mitigations/M1009,M1009
1,course-of-action,Use Device-Provided Credential Storage,Application developers should use device-provided credential storage mechanisms such as Android's KeyStore or iOS's KeyChain. These can prevent credentials from being exposed to an adversary.,https://attack.mitre.org/mitigations/M1009,M1009
2,course-of-action,Use Recent OS Version,New mobile operating system versions bring not only patches against discovered vulnerabilities but also often bring security architecture improvements that provide resilience against potential vulnerabilities or weaknesses that have not yet been discovered. They may also bring improvements that block use of observed adversary techniques.,https://attack.mitre.org/mitigations/M1005,M1005
3,course-of-action,Application Vetting,"Enterprises can vet applications for exploitable vulnerabilities or unwanted (privacy-invasive or malicious) behaviors. Enterprises can inspect applications themselves or use a third-party service.

Enterprises may impose policies to only allow pre-approved applications to be installed on their devices or may impose policies to block use of specific applications known to have issues. In Bring Your Own Device (BYOD) environments, enterprises may only be able to impose these policies over an enterprise-managed portion of the device.

Application Vetting is not a complete mitigation. Techniques such as [Evade Analysis Environment](https://attack.mitre.org/techniques/T1523) exist that can enable adversaries to bypass vetting.",https://attack.mitre.org/mitigations/M1013,M1013
4,course-of-action,Application Developer Guidance,This mitigation describes any guidance or training given to developers of applications to avoid introducing security weaknesses that an adversary may be able to take advantage of.,https://attack.mitre.org/mitigations/M1012,M1012
5,course-of-action,Enterprise Policy,"An enterprise mobility management (EMM), also known as mobile device management (MDM), system can be used to provision policies to mobile devices to control aspects of their allowed behavior.",https://attack.mitre.org/mitigations/M1011,M1011
6,course-of-action,User Guidance,Describes any guidance or training given to users to set particular configuration settings or avoid specific potentially risky behaviors.,https://attack.mitre.org/mitigations/M1004,M1004
7,course-of-action,System Partition Integrity,"Ensure that Android devices being used include and enable the Verified Boot capability, which cryptographically ensures the integrity of the system partition.",https://attack.mitre.org/mitigations/M1009,M1009
8,course-of-action,Security Updates,"Install security updates in response to discovered vulnerabilities.

Purchase devices with a vendor and/or mobile carrier commitment to provide security updates in a prompt manner for a set period of time.

Decommission devices that will no longer receive security updates.

Limit or block access to enterprise resources from devices that have not installed recent security updates.

On Android devices, access can be controlled based on each device's security patch level. On iOS devices, access can be controlled based on the iOS version.",https://attack.mitre.org/mitigations/M1003,M1003
9,course-of-action,Deploy Compromised Device Detection Method,"A variety of methods exist that can be used to enable enterprises to identify compromised (e.g. rooted/jailbroken) devices, whether using security mechanisms built directly into the device, third-party mobile security applications, enterprise mobility management (EMM)/mobile device management (MDM) capabilities, or other methods. Some methods may be trivial to evade while others may be more sophisticated.",https://attack.mitre.org/mitigations/M1001,M1001
10,course-of-action,Interconnection Filtering,"In order to mitigate Signaling System 7 (SS7) exploitation, the Communications, Security, Reliability, and Interoperability Council (CSRIC) describes filtering interconnections between network operators to block inappropriate requests (Citation: CSRIC5-WG10-FinalReport).",https://attack.mitre.org/mitigations/M1010,M1010
11,course-of-action,Caution with Device Administrator Access,"Warn device users not to accept requests to grant Device Administrator access to applications without good reason.

Additionally, application vetting should include a check on whether the application requests Device Administrator access. Applications that do request Device Administrator access should be carefully scrutinized and only allowed to be used if a valid reason exists.",https://attack.mitre.org/mitigations/M1014,M1014
12,attack-pattern,Obtain Device Cloud Backups,"An adversary who is able to obtain unauthorized access to or misuse authorized access to cloud backup services (e.g. Google's Android backup service or Apple's iCloud) could use that access to obtain sensitive data stored in device backups. For example, the Elcomsoft Phone Breaker product advertises the ability to retrieve iOS backup data from Apple's iCloud (Citation: Elcomsoft-EPPB). Elcomsoft also describes (Citation: Elcomsoft-WhatsApp) obtaining WhatsApp communication histories from backups stored in iCloud.",https://attack.mitre.org/software/S0479,S0479
13,attack-pattern,Insecure Third-Party Libraries,,https://attack.mitre.org/software/S0423,S0423
14,attack-pattern,Call Log ,"Adversaries may utilize standard operating system APIs to gather call log data. On Android, this can be accomplished using the Call Log Content Provider. iOS provides no standard API to access the call log. 

 

If the device has been jailbroken or rooted, an adversary may be able to access the [Call Log ](https://attack.mitre.org/techniques/T1636/002) without the user’s knowledge or approval. ",https://attack.mitre.org/software/S0507,S0507
15,attack-pattern,App Delivered via Email Attachment,,https://attack.mitre.org/software/S0407,S0407
16,attack-pattern,Impair Defenses,"Adversaries may maliciously modify components of a victim environment in order to hinder or disable defensive mechanisms. This not only involves impairing preventative defenses, such as anti-virus, but also detection capabilities that defenders can use to audit activity and identify malicious behavior. This may span both native defenses as well as supplemental capabilities installed by users or mobile endpoint administrators.",https://attack.mitre.org/software/S0539,S0539
17,attack-pattern,Exploitation of Remote Services,"Adversaries may exploit remote services of enterprise servers, workstations, or other resources to gain unauthorized access to internal systems once inside of a network. Adversaries may exploit remote services by taking advantage of a mobile device’s access to an internal enterprise network through local connectivity or through a Virtual Private Network (VPN). Exploitation of a software vulnerability occurs when an adversary takes advantage of a programming error in a program, service, or within the operating system software or kernel itself to execute adversary-controlled code. A common goal for post-compromise exploitation of remote services is for lateral movement to enable access to a remote system. 

An adversary may need to determine if the remote system is in a vulnerable state, which may be done through [Network Service Scanning](https://attack.mitre.org/techniques/T1423) or other Discovery methods. These look for common, vulnerable software that may be deployed in the network, the lack of certain patches that may indicate vulnerabilities, or security software that may be used to detect or contain remote exploitation. Servers are likely a high value target for lateral movement exploitation, but endpoint systems may also be at risk if they provide an advantage or access to additional resources.

Depending on the permissions level of the vulnerable remote service, an adversary may achieve [Exploitation for Privilege Escalation](https://attack.mitre.org/techniques/T1404) as a result of lateral movement exploitation as well. ",https://attack.mitre.org/software/S0418,S0418
18,attack-pattern,Keychain,"Adversaries may collect the keychain storage data from an iOS device to acquire credentials. Keychains are the built-in way for iOS to keep track of users' passwords and credentials for many services and features such as Wi-Fi passwords, websites, secure notes, certificates, private keys, and VPN credentials.

On the device, the keychain database is stored outside of application sandboxes to prevent unauthorized access to the raw data. Standard iOS APIs allow applications access to their own keychain contained within the database. By utilizing a privilege escalation exploit or existing root access, an adversary can access the entire encrypted database.(Citation: Apple Keychain Services)(Citation: Elcomsoft Decrypt Keychain)",https://attack.mitre.org/software/S0509,S0509
19,attack-pattern,Dynamic Resolution,"Adversaries may dynamically establish connections to command and control infrastructure to evade common detections and remediations. This may be achieved by using malware that shares a common algorithm with the infrastructure the adversary uses to receive the malware's communications. This algorithm can be used to dynamically adjust parameters such as the domain name, IP address, or port number the malware uses for command and control.",https://attack.mitre.org/software/S0426,S0426
20,attack-pattern,Access Notifications,"Adversaries may collect data within notifications sent by the operating system or other applications. Notifications may contain sensitive data such as one-time authentication codes sent over SMS, email, or other mediums. In the case of Credential Access, adversaries may attempt to intercept one-time code sent to the device. Adversaries can also dismiss notifications to prevent the user from noticing that the notification has arrived and can trigger action buttons contained within notifications.(Citation: ESET 2FA Bypass) ",https://attack.mitre.org/software/S0577,S0577
21,attack-pattern,Input Prompt,"The operating system and installed applications often have legitimate needs to prompt the user for sensitive information such as account credentials, bank account information, or Personally Identifiable Information (PII). Adversaries may mimic this functionality to prompt users for sensitive information.

Compared to traditional PCs, the constrained display size of mobile devices may impair the ability to provide users with contextual information, making users more susceptible to this technique’s use.(Citation: Felt-PhishingOnMobileDevices)

Specific approaches to this technique include:

### Impersonate the identity of a legitimate application

A malicious application could impersonate the identity of a legitimate application (e.g. use the same application name and/or icon) and get installed on the device. The malicious app could then prompt the user for sensitive information.(Citation: eset-finance)

### Display a prompt on top of a running legitimate application

A malicious application could display a prompt on top of a running legitimate application to trick users into entering sensitive information into the malicious application rather than the legitimate application. Typically, the malicious application would need to know when the targeted application (and individual activity within the targeted application) is running in the foreground, so that the malicious application knows when to display its prompt. Android 5.0 and 5.1.1, respectively, increased the difficulty of determining the current foreground application through modifications to the `ActivityManager` API.(Citation: Android-getRunningTasks)(Citation: StackOverflow-getRunningAppProcesses). A malicious application can still abuse Android’s accessibility features to determine which application is currently in the foreground.(Citation: ThreatFabric Cerberus) Approaches to display a prompt include:

* A malicious application could start a new activity on top of a running legitimate application.(Citation: Felt-PhishingOnMobileDevices)(Citation: Hassell-ExploitingAndroid) Android 10 places new restrictions on the ability for an application to start a new activity on top of another application, which may make it more difficult for adversaries to utilize this technique.(Citation: Android Background)
* A malicious application could create an application overlay window on top of a running legitimate application. Applications must hold the `SYSTEM_ALERT_WINDOW` permission to create overlay windows. This permission is handled differently than typical Android permissions, and at least under certain conditions is automatically granted to applications installed from the Google Play Store.(Citation: Cloak and Dagger)(Citation: NowSecure Android Overlay)(Citation: Skycure-Accessibility) The `SYSTEM_ALERT_WINDOW` permission and its associated ability to create application overlay windows are expected to be deprecated in a future release of Android in favor of a new API.(Citation: XDA Bubbles)

### Fake device notifications

A malicious application could send fake device notifications to the user. Clicking on the device notification could trigger the malicious application to display an input prompt.(Citation: Group IB Gustuff Mar 2019)",https://attack.mitre.org/software/S0524,S0524
22,attack-pattern,GUI Input Capture,"Adversaries may mimic common operating system GUI components to prompt users for sensitive information with a seemingly legitimate prompt. The operating system and installed applications often have legitimate needs to prompt the user for sensitive information such as account credentials, bank account information, or Personally Identifiable Information (PII). Compared to traditional PCs, the constrained display size of mobile devices may impair the ability to provide users with contextual information, making users more susceptible to this technique’s use.(Citation: Felt-PhishingOnMobileDevices)

There are several approaches adversaries may use to mimic this functionality. Adversaries may impersonate the identity of a legitimate application (e.g. use the same application name and/or icon) and, when installed on the device, may prompt the user for sensitive information.(Citation: eset-finance) Adversaries may also send fake device notifications to the user that may trigger the display of an input prompt when clicked.(Citation: Group IB Gustuff Mar 2019) 

Additionally, adversaries may display a prompt on top of a running, legitimate application to trick users into entering sensitive information into a malicious application rather than the legitimate application. Typically, adversaries need to know when the targeted application and the individual activity within the targeted application is running in the foreground to display the prompt at the proper time. Adversaries can abuse Android’s accessibility features to determine which application is currently in the foreground.(Citation: ThreatFabric Cerberus) Two known approaches to displaying a prompt include:

* Adversaries start a new activity on top of a running legitimate application.(Citation: Felt-PhishingOnMobileDevices)(Citation: Hassell-ExploitingAndroid) Android 10 places new restrictions on the ability for an application to start a new activity on top of another application, which may make it more difficult for adversaries to utilize this technique.(Citation: Android Background)
* Adversaries create an application overlay window on top of a running legitimate application. Applications must hold the `SYSTEM_ALERT_WINDOW` permission to create overlay windows. This permission is handled differently than typical Android permissions and, at least under certain conditions, is automatically granted to applications installed from the Google Play Store.(Citation: Cloak and Dagger)(Citation: NowSecure Android Overlay)(Citation: Skycure-Accessibility) The `SYSTEM_ALERT_WINDOW` permission and its associated ability to create application overlay windows are expected to be deprecated in a future release of Android in favor of a new API.(Citation: XDA Bubbles)",https://attack.mitre.org/software/S0555,S0555
23,attack-pattern,Remotely Wipe Data Without Authorization,An adversary who is able to obtain unauthorized access to or misuse authorized access to cloud services (e.g. Google's Android Device Manager or Apple iCloud's Find my iPhone) or to an EMM console could use that access to wipe enrolled devices (Citation: Honan-Hacking).,https://attack.mitre.org/software/S0422,S0422
24,attack-pattern,Foreground Persistence,"Adversaries may abuse Android's `startForeground()` API method to maintain continuous sensor access. Beginning in Android 9, idle applications running in the background no longer have access to device sensors, such as the camera, microphone, and gyroscope.(Citation: Android-SensorsOverview) Applications can retain sensor access by running in the foreground, using Android’s `startForeground()` API method. This informs the system that the user is actively interacting with the application, and it should not be killed. The only requirement to start a foreground service is showing a persistent notification to the user.(Citation: Android-ForegroundServices)

Malicious applications may abuse the `startForeground()` API method to continue running in the foreground, while presenting a notification to the user pretending to be a genuine application. This would allow unhindered access to the device’s sensors, assuming permission has been previously granted.(Citation: BlackHat Sutter Android Foreground 2019)

Malicious applications may also abuse the `startForeground()` API to inform the Android system that the user is actively interacting with the application, thus preventing it from being killed by the low memory killer.(Citation: TrendMicro-Yellow Camera)",https://attack.mitre.org/software/S0182,S0182
25,attack-pattern,Remotely Track Device Without Authorization,An adversary who is able to obtain unauthorized access to or misuse authorized access to cloud services (e.g. Google's Android Device Manager or Apple iCloud's Find my iPhone) or to an enterprise mobility management (EMM) / mobile device management (MDM) server console could use that access to track mobile devices.(Citation: Krebs-Location),https://attack.mitre.org/software/S0440,S0440
26,attack-pattern,Stored Application Data,"Adversaries may try to access and collect application data resident on the device. Adversaries often target popular applications, such as Facebook, WeChat, and Gmail.(Citation: SWB Exodus March 2019) 

 

Due to mobile OS sandboxing, this technique is only possible in three scenarios: 

 

* An application stores files in unprotected external storage 
* An application stores files in its internal storage directory with insecure permissions (e.g. 777) 
* The adversary gains root permissions on the device ",https://attack.mitre.org/software/S0540,S0540
27,attack-pattern,Manipulate App Store Rankings or Ratings,An adversary could use access to a compromised device's credentials to attempt to manipulate app store rankings or ratings by triggering application downloads or posting fake reviews of applications. This technique likely requires privileged access (a rooted or jailbroken device).,https://attack.mitre.org/software/S0536,S0536
28,attack-pattern,Compromise Software Dependencies and Development Tools,Adversaries may manipulate products or product delivery mechanisms prior to receipt by a final consumer for the purpose of data or system compromise. Applications often depend on external software to function properly. Popular open source projects that are used as dependencies in many applications may be targeted as a means to add malicious code to users of the dependency.(Citation: Grace-Advertisement),https://attack.mitre.org/software/S0478,S0478
29,attack-pattern,URI Hijacking,"Adversaries may register Uniform Resource Identifiers (URIs) to intercept sensitive data. 

Applications regularly register URIs with the operating system to act as a response handler for various actions, such as logging into an app using an external account via single sign-on. This allows redirections to that specific URI to be intercepted by the application. If an adversary were to register for a URI that was already in use by a genuine application, the adversary may be able to intercept data intended for the genuine application or perform a phishing attack against the genuine application. Intercepted data may include OAuth authorization codes or tokens that could be used by the adversary to gain access to protected resources.(Citation: Trend Micro iOS URL Hijacking)(Citation: IETF-PKCE) ",https://attack.mitre.org/software/S0544,S0544
30,attack-pattern,Access Call Log,"On Android, an adversary could call standard operating system APIs from a malicious application to gather call log data, or with escalated privileges could directly access files containing call log data.

On iOS, applications do not have access to the call log, so privilege escalation would be required in order to access the data.",https://attack.mitre.org/software/S0403,S0403
31,attack-pattern,Device Administrator Permissions,"Adversaries may request device administrator permissions to perform malicious actions.

By abusing the device administration API, adversaries can perform several nefarious actions, such as resetting the device’s password for [Device Lockout](https://attack.mitre.org/techniques/T1446), factory resetting the device to [Delete Device Data](https://attack.mitre.org/techniques/T1447) and any traces of the malware, disabling all of the device’s cameras, or make it more difficult to uninstall the app.(Citation: Android DeviceAdminInfo)

Device administrators must be approved by the user at runtime, with a system popup showing which of the actions have been requested by the app. In conjunction with other techniques, such as [Input Injection](https://attack.mitre.org/techniques/T1516), an app can programmatically grant itself administrator permissions without any user input.",https://attack.mitre.org/software/S0421,S0421
32,attack-pattern,Keychain,"Adversaries may collect keychain data from an iOS device to acquire credentials. Keychains are the built-in way for iOS to keep track of users' passwords and credentials for many services and features such as Wi-Fi passwords, websites, secure notes, certificates, private keys, and VPN credentials. 

On the device, the keychain database is stored outside of application sandboxes to prevent unauthorized access to the raw data. Standard iOS APIs allow applications access to their own keychain contained within the database. By utilizing a privilege escalation exploit or existing root access, adversaries can access the entire encrypted database.(Citation: Apple Keychain Services)(Citation: Elcomsoft Decrypt Keychain) ",https://attack.mitre.org/software/S0399,S0399
33,attack-pattern,Uninstall Malicious Application,"Adversaries may include functionality in malware that uninstalls the malicious application from the device. This can be achieved by:

* Abusing device owner permissions to perform silent uninstallation using device owner API calls.
* Abusing root permissions to delete files from the filesystem.
* Abusing the accessibility service. This requires an intent be sent to the system to request uninstallation, and then abusing the accessibility service to click the proper places on the screen to confirm uninstallation.",https://attack.mitre.org/software/S0602,S0602
34,attack-pattern,Carrier Billing Fraud,"A malicious app may trigger fraudulent charges on a victim’s carrier billing statement in several different ways, including SMS toll fraud and SMS shortcodes that make purchases.

Performing SMS fraud relies heavily upon the fact that, when making SMS purchases, the carriers perform device verification but not user verification. This allows adversaries to make purchases on behalf of the user, with little or no user interaction.(Citation: Google Bread)

Malicious applications may also perform toll billing, which occurs when carriers provide payment endpoints over a web page. The application connects to the web page over cellular data so the carrier can directly verify the number, or the application must retrieve a code sent via SMS and enter it into the web page.(Citation: Google Bread)

On iOS, apps cannot send SMS messages.

On Android, apps must hold the `SEND_SMS` permission to send SMS messages. Additionally, Android version 4.2 and above has mitigations against this threat by requiring user consent before allowing SMS messages to be sent to premium numbers (Citation: AndroidSecurity2014).",https://attack.mitre.org/software/S0558,S0558
35,attack-pattern,Stolen Developer Credentials or Signing Keys,,https://attack.mitre.org/software/S0522,S0522
