,type,name,Mitigation,url,Tactick_Id
311,attack-pattern,Unix Shell,"Adversaries may abuse Unix shell commands and scripts for execution. Unix shells are the underlying command prompts on Android and iOS devices. Unix shells can control every aspect of a system, with certain commands requiring elevated privileges that are only accessible if the device has been rooted or jailbroken. 

Unix shells also support scripts that enable sequential execution of commands as well as other typical programming operations such as conditionals and loops. Common uses of shell scripts include long or repetitive tasks, or the need to run the same set of commands on multiple systems. 

Adversaries may abuse Unix shells to execute various commands or payloads. Interactive shells may be accessed through command and control channels or during lateral movement such as with SSH. Adversaries may also leverage shell scripts to deliver and execute multiple commands on victims or as part of payloads used for persistence. 

If the device has been rooted or jailbroken, adversaries may locate and invoke a superuser binary to elevate their privileges and interact with the system as the root user. This dangerous level of permissions allows the adversary to run special commands and modify protected system files.  ",https://attack.mitre.org/techniques/T1636/002,T1636.002
312,attack-pattern,App Delivered via Web Download,,https://attack.mitre.org/techniques/T1418/001,T1418.001
313,attack-pattern,System Checks,"Adversaries may employ various system checks to detect and avoid virtualization and analysis environments. This may include changing behavior after checking for the presence of artifacts indicative of a virtual environment or sandbox. If the adversary detects a virtual environment, they may alter their malware’s behavior to disengage from the victim or conceal the core functions of the implant. They may also search for virtualization artifacts before dropping secondary or additional payloads. 

Checks could include generic system properties such as host/domain name and samples of network traffic. Adversaries may also check the network adapters addresses, CPU core count, and available memory/drive size. 

Hardware checks, such as the presence of motion sensors, could also be used to gather evidence that can be indicative a virtual environment. Adversaries may also query for specific readings from these devices. ",https://attack.mitre.org/techniques/T1631/001,T1631.001
314,attack-pattern,Manipulate App Store Rankings or Ratings,An adversary could use access to a compromised device's credentials to attempt to manipulate app store rankings or ratings by triggering application downloads or posting fake reviews of applications. This technique likely requires privileged access (a rooted or jailbroken device).,https://attack.mitre.org/techniques/T1629,T1629
315,attack-pattern,Geofencing,"Adversaries may use a device’s geographical location to limit certain malicious behaviors. For example, malware operators may limit the distribution of a second stage payload to certain geographic regions.(Citation: Lookout eSurv)

[Geofencing](https://attack.mitre.org/techniques/T1581) is accomplished by persuading the user to grant the application permission to access location services. The application can then collect, process, and exfiltrate the device’s location to perform location-based actions, such as ceasing malicious behavior or showing region-specific advertisements.

One method to accomplish [Geofencing](https://attack.mitre.org/techniques/T1581) on Android is to use the built-in Geofencing API to automatically trigger certain behaviors when the device enters or exits a specified radius around a geographical location. Similar to other [Geofencing](https://attack.mitre.org/techniques/T1581) methods, this requires that the user has granted the `ACCESS_FINE_LOCATION` and `ACCESS_BACKGROUND_LOCATION` permissions. The latter is only required if the application targets Android 10 (API level 29) or higher. However, Android 11 introduced additional permission controls that may restrict background location collection based on user permission choices at runtime. These additional controls include “Allow only while using the app”, which will effectively prohibit background location collection.(Citation: Android Geofencing API)

Similarly, on iOS, developers can use built-in APIs to setup and execute geofencing. Depending on the use case, the app will either need to call `requestWhenInUseAuthorization()` or `requestAlwaysAuthorization()`, depending on when access to the location services is required. Similar to Android, users also have the option to limit when the application can access the device’s location, including one-time use and only when the application is running in the foreground.(Citation: Apple Location Services)

[Geofencing](https://attack.mitre.org/techniques/T1581) can be used to prevent exposure of capabilities in environments that are not intended to be compromised or operated within. For example, location data could be used to limit malware spread and/or capabilities, which could also potentially evade application analysis environments (ex: malware analysis outside of the target geographic area). Other malicious usages could include showing language-specific [Input Prompt](https://attack.mitre.org/techniques/T1411)s and/or advertisements.",https://attack.mitre.org/techniques/T1428,T1428
316,attack-pattern,Remotely Install Application,,https://attack.mitre.org/techniques/T1437/001,T1437.001
317,attack-pattern,Modify Cached Executable Code,"ART (the Android Runtime) compiles optimized code on the device itself to improve performance. An adversary may be able to use escalated privileges to modify the cached code in order to hide malicious behavior. Since the code is compiled on the device, it may not receive the same level of integrity checks that are provided to code running in the system partition.(Citation: Sabanal-ART)",https://attack.mitre.org/techniques/T1635,T1635
318,attack-pattern,Bidirectional Communication,"Adversaries may use an existing, legitimate external Web service channel as a means for sending commands to and receiving output from a compromised system. Compromised systems may leverage popular websites and social media to host command and control (C2) instructions. Those infected systems can then send the output from those commands back over that Web service channel. The return traffic may occur in a variety of ways, depending on the Web service being utilized. For example, the return traffic may take the form of the compromised system posting a comment on a forum, issuing a pull request to development project, updating a document hosted on a Web service, or by sending a Tweet. 

 

Popular websites and social media, acting as a mechanism for C2, may give a significant amount of cover. This is due to the likelihood that hosts within a network are already communicating with them prior to a compromise. Using common services, such as those offered by Google or Twitter, makes it easier for adversaries to hide in expected noise. Web service providers commonly use SSL/TLS encryption, giving adversaries an added level of protection. ",https://attack.mitre.org/techniques/T1628/002,T1628.002
319,attack-pattern,Non-Standard Port,"Adversaries may generate network traffic using a protocol and port paring that are typically not associated. For example, HTTPS over port 8088 or port 587 as opposed to the traditional port 443. Adversaries may make changes to the standard port used by a protocol to bypass filtering or muddle analysis/parsing of network data.",https://attack.mitre.org/techniques/T1633,T1633
320,attack-pattern,Compromise Software Supply Chain,"Adversaries may manipulate application software prior to receipt by a final consumer for the purpose of data or system compromise. Supply chain compromise of software can take place in a number of ways, including manipulation of the application source code, manipulation of the update/distribution mechanism for that software, or replacing compiled releases with a modified version.",https://attack.mitre.org/techniques/T1579,T1579
321,attack-pattern,Device Lockout,"An adversary may seek to lock the legitimate user out of the device, for example to inhibit user interaction or to obtain a ransom payment.

On Android versions prior to 7, apps can abuse Device Administrator access to reset the device lock passcode to prevent the user from unlocking the device. After Android 7, only device or profile owners (e.g. MDMs) can reset the device’s passcode.(Citation: Android resetPassword)

On iOS devices, this technique does not work because mobile device management servers can only remove the screen lock passcode, they cannot set a new passcode. However, on jailbroken devices, malware has been discovered that can lock the user out of the device.(Citation: Xiao-KeyRaider)",https://attack.mitre.org/techniques/T1413,T1413
322,attack-pattern,Stolen Developer Credentials or Signing Keys,,https://attack.mitre.org/techniques/T1623,T1623
323,attack-pattern,SIM Card Swap,"An adversary could convince the mobile network operator (e.g. through social networking, forged identification, or insider attacks performed by trusted employees) to issue a new SIM card and associate it with an existing phone number and account.(Citation: NYGov-Simswap)(Citation: Motherboard-Simswap2) The adversary could then obtain SMS messages or hijack phone calls intended for someone else.(Citation: Betanews-Simswap)

One use case is intercepting authentication messages or phone calls to obtain illicit access to online banking or other online accounts, as many online services allow account password resets by sending an authentication code over SMS to a phone number associated with the account.(Citation: Guardian-Simswap)(Citation: Motherboard-Simswap1)(Citation: Krebs-SimSwap)(Citation: TechCrunch-SimSwap)",https://attack.mitre.org/techniques/T1629/003,T1629.003
324,attack-pattern,Input Capture,"Adversaries may use methods of capturing user input to obtain credentials or collect information. During normal device usage, users often provide credentials to various locations, such as login pages/portals or system dialog boxes. Input capture mechanisms may be transparent to the user (e.g. [Keylogging](https://attack.mitre.org/techniques/T1417/001)) or rely on deceiving the user into providing input into what they believe to be a genuine application prompt (e.g. [GUI Input Capture](https://attack.mitre.org/techniques/T1417/002)).",https://attack.mitre.org/techniques/T1544,T1544
325,attack-pattern,Generate Traffic from Victim,"Adversaries may generate outbound traffic from devices. This is typically performed to manipulate external outcomes, such as to achieve carrier billing fraud or to manipulate app store rankings or ratings. Outbound traffic is typically generated as SMS messages or general web traffic, but may take other forms as well.

If done via SMS messages, Android apps must hold the `SEND_SMS` permission. Additionally, sending an SMS message requires user consent if the recipient is a premium number. Applications cannot send SMS messages on iOS",https://attack.mitre.org/techniques/T1637,T1637
326,attack-pattern,Masquerade as Legitimate Application,"An adversary could distribute developed malware by masquerading the malware as a legitimate application. This can be done in two different ways: by embedding the malware in a legitimate application, or by pretending to be a legitimate application.

Embedding the malware in a legitimate application is done by downloading the application, disassembling it, adding the malicious code, and then re-assembling it.(Citation: Zhou) The app would appear to be the original app, but would contain additional malicious functionality. The adversary could then publish the malicious application to app stores or use another delivery method.

Pretending to be a legitimate application relies heavily on lack of scrutinization by the user. Typically, a malicious app pretending to be a legitimate one will have many similar details as the legitimate one, such as name, icon, and description.(Citation: Palo Alto HenBox)

Malicious applications may also masquerade as legitimate applications when requesting access to the accessibility service in order to appear as legitimate to the user, increasing the likelihood that the access will be granted.",https://attack.mitre.org/techniques/T1477,T1477
327,attack-pattern,SMS Control,"Adversaries may delete, alter, or send SMS messages without user authorization. This could be used to hide C2 SMS messages, spread malware, or various external effects.

This can be accomplished by requesting the `RECEIVE_SMS` or `SEND_SMS` permissions depending on what the malware is attempting to do. If the app is set as the default SMS handler on the device, the `SMS_DELIVER` broadcast intent can be registered, which allows the app to write to the SMS content provider. The content provider directly modifies the messaging database on the device, which could allow malicious applications with this ability to insert, modify, or delete arbitrary messages on the device.(Citation: SMS KitKat)(Citation: Android SmsProvider)",https://attack.mitre.org/techniques/T1423,T1423
328,attack-pattern,Disguise Root/Jailbreak Indicators,"An adversary could use knowledge of the techniques used by security software to evade detection(Citation: Brodie)(Citation: Tan). For example, some mobile security products perform compromised device detection by searching for particular artifacts such as an installed ""su"" binary, but that check could be evaded by naming the binary something else. Similarly, polymorphic code techniques could be used to evade signature-based detection(Citation: Rastogi).",https://attack.mitre.org/techniques/T1618,T1618
329,attack-pattern,Exfiltration Over Other Network Medium,"Adversaries may attempt to exfiltrate data over a different network medium than the command and control channel. If the command and control network is a standard Internet connection, the exfiltration may occur, for example, via Bluetooth, or another radio frequency (RF) channel. 

Adversaries may choose to do this if they have sufficient access or proximity, and the connection might not be secured or defended as well as the primary Internet-connected channel because it is not routed through the same enterprise network. ",https://attack.mitre.org/techniques/T1646,T1646
330,attack-pattern,Process Injection,"Adversaries may inject code into processes in order to evade process-based defenses or even elevate privileges. Process injection is a method of executing arbitrary code in the address space of a separate live process. Running code in the context of another process may allow access to the process's memory, system/network resources, and possibly elevated privileges. Execution via process injection may also evade detection from security products since the execution is masked under a legitimate process. 

Both Android and iOS have no legitimate way to achieve process injection. The only way this is possible is by abusing existing root access or exploiting a vulnerability.",https://attack.mitre.org/techniques/T1404,T1404
331,attack-pattern,Symmetric Cryptography,"Adversaries may employ a known symmetric encryption algorithm to conceal command and control traffic, rather than relying on any inherent protections provided by a communication protocol. Symmetric encryption algorithms use the same key for plaintext encryption and ciphertext decryption. Common symmetric encryption algorithms include AES, Blowfish, and RC4.",https://attack.mitre.org/techniques/T1616,T1616
332,attack-pattern,SMS Messages,"Adversaries may utilize standard operating system APIs to gather SMS messages. On Android, this can be accomplished using the SMS Content Provider. iOS provides no standard API to access SMS messages. 

If the device has been jailbroken or rooted, an adversary may be able to access [SMS Messages](https://attack.mitre.org/techniques/T1636/004) without the user’s knowledge or approval. ",https://attack.mitre.org/techniques/T1639/001,T1639.001
333,attack-pattern,System Runtime API Hijacking,"Adversaries may execute their own malicious payloads by hijacking the way an operating system run applications. Hijacking execution flow can be for the purposes of persistence since this hijacked execution may reoccur at later points in time. 


On Android, adversaries may overwrite the standard OS API library with a malicious alternative to hook into core functions to achieve persistence. By doing this, the adversary’s code will be executed every time the overwritten API function is called by an app on the infected device.",https://attack.mitre.org/techniques/T1624/001,T1624.001
334,attack-pattern,Credentials from Password Store,"Adversaries may search common password storage locations to obtain user credentials. Passwords can be stored in several places on a device, depending on the operating system or application holding the credentials. There are also specific applications that store passwords to make it easier for users manage and maintain. Once credentials are obtained, they can be used to perform lateral movement and access restricted information.",https://attack.mitre.org/techniques/T1436,T1436
335,attack-pattern,Hooking,"Adversaries may utilize hooking to hide the presence of artifacts associated with their behaviors to evade detection. Hooking can be used to modify return values or data structures of system APIs and function calls. This process typically involves using 3rd party root frameworks, such as Xposed or Magisk, with either a system exploit or pre-existing root access. By including custom modules for root frameworks, adversaries can hook system APIs and alter the return value and/or system data structures to alter functionality/visibility of various aspects of the system.",https://attack.mitre.org/techniques/T1439,T1439
336,attack-pattern,Input Injection,"A malicious application can inject input to the user interface to mimic user interaction through the abuse of Android's accessibility APIs.

[Input Injection](https://attack.mitre.org/techniques/T1516) can be achieved using any of the following methods:

* Mimicking user clicks on the screen, for example to steal money from a user's PayPal account.(Citation: android-trojan-steals-paypal-2fa)
* Injecting global actions, such as `GLOBAL_ACTION_BACK` (programatically mimicking a physical back button press), to trigger actions on behalf of the user.(Citation: Talos Gustuff Apr 2019)
* Inserting input into text fields on behalf of the user. This method is used legitimately to auto-fill text fields by applications such as password managers.(Citation: bitwarden autofill logins)",https://attack.mitre.org/techniques/T1517,T1517
337,attack-pattern,Compromise Application Executable,"Adversaries may modify applications installed on a device to establish persistent access to a victim. These malicious modifications can be used to make legitimate applications carry out adversary tasks when these applications are in use.

There are multiple ways an adversary can inject malicious code into applications. One method is by taking advantages of device vulnerabilities, the most well-known being Janus, an Android vulnerability that allows adversaries to add extra bytes to APK (application) and DEX (executable) files without affecting the file's signature. By being able to add arbitrary bytes to valid applications, attackers can seamlessly inject code into genuine executables without the user's knowledge.(Citation: Guardsquare Janus)

Adversaries may also rebuild applications to include malicious modifications. This can be achieved by decompiling the genuine application, merging it with the malicious code, and recompiling it.(Citation: CheckPoint Agent Smith)

Adversaries may also take action to conceal modifications to application executables and bypass user consent. These actions include altering modifications to appear as an update or exploiting vulnerabilities that allow activities of the malicious application to run inside a system application.(Citation: CheckPoint Agent Smith)",https://attack.mitre.org/techniques/T1410,T1410
338,attack-pattern,System Network Configuration Discovery,"Adversaries may look for details about the network configuration and settings, such as IP and/or MAC addresses, of operating systems they access or through information discovery of remote systems. 

 

On Android, details of onboard network interfaces are accessible to apps through the `java.net.NetworkInterface` class.(Citation: NetworkInterface) Previously, the Android `TelephonyManager` class could be used to gather telephony-related device identifiers, information such as the IMSI, IMEI, and phone number. However, starting with Android 10, only preloaded, carrier, the default SMS, or device and profile owner applications can access the telephony-related device identifiers.(Citation: TelephonyManager) 

 

On iOS, gathering network configuration information is not possible without root access. 

 

Adversaries may use the information from [System Network Configuration Discovery](https://attack.mitre.org/techniques/T1422) during automated discovery to shape follow-on behaviors, including determining certain access within the target network and what actions to do next. ",https://attack.mitre.org/techniques/T1411,T1411
339,attack-pattern,Fake Developer Accounts,,https://attack.mitre.org/techniques/T1639,T1639
340,attack-pattern,Geofencing,"Adversaries may use a device’s geographical location to limit certain malicious behaviors. For example, malware operators may limit the distribution of a second stage payload to certain geographic regions.(Citation: Lookout eSurv)

[Geofencing](https://attack.mitre.org/techniques/T1627/001) is accomplished by persuading the user to grant the application permission to access location services. The application can then collect, process, and exfiltrate the device’s location to perform location-based actions, such as ceasing malicious behavior or showing region-specific advertisements. 

One method to accomplish [Geofencing](https://attack.mitre.org/techniques/T1627/001) on Android is to use the built-in Geofencing API to automatically trigger certain behaviors when the device enters or exits a specified radius around a geographical location. Similar to  other [Geofencing](https://attack.mitre.org/techniques/T1627/001) methods, this requires that the user has granted the `ACCESS_FINE_LOCATION` and `ACCESS_BACKGROUND_LOCATION` permissions. The latter is only required if the application targets Android 10 (API level 29) or higher. However, Android 11 introduced additional permission controls that may restrict background location collection based on user permission choices at runtime. These additional controls include ""Allow only while using the app"", which will effectively prohibit background location collection.  

Similarly, on iOS, developers can use built-in APIs to setup and execute geofencing. Depending on the use case, the app will either need to call `requestWhenInUseAuthorization()` or `requestAlwaysAuthorization()`, depending on when access to the location services is required. Similar to Android, users also have the option to limit when the application can access the device’s location, including one-time use and only when the application is running in the foreground.  

[Geofencing](https://attack.mitre.org/techniques/T1627/001) can be used to prevent exposure of capabilities in environments that are not intended to be compromised or operated within. For example, location data could be used to limit malware spread and/or capabilities, which could also potentially evade application analysis environments (ex: malware analysis outside of the target geographic area). Other malicious usages could include showing language-specific input prompts and/or advertisements.",https://attack.mitre.org/techniques/T1398,T1398
341,attack-pattern,Out of Band Data,"Adversaries may communicate with compromised devices using out of band data streams. This could be done for a variety of reasons, including evading network traffic monitoring, as a backup method of command and control, or for data exfiltration if the device is not connected to any Internet-providing networks (i.e. cellular or Wi-Fi). Several out of band data streams exist, such as SMS messages, NFC, and Bluetooth. 

 

On Android, applications can read push notifications to capture content from SMS messages, or other out of band data streams. This requires that the user manually grant notification access to the application via the settings menu. However, the application could launch an Intent to take the user directly there. 

 

On iOS, there is no way to programmatically read push notifications. ",https://attack.mitre.org/techniques/T1627,T1627
342,attack-pattern,Exploit TEE Vulnerability,"A malicious app or other attack vector could be used to exploit vulnerabilities in code running within the Trusted Execution Environment (TEE) (Citation: Thomas-TrustZone). The adversary could then obtain privileges held by the TEE potentially including the ability to access cryptographic keys or other sensitive data (Citation: QualcommKeyMaster). Escalated operating system privileges may be first required in order to have the ability to attack the TEE (Citation: EkbergTEE). If not, privileges within the TEE can potentially be used to exploit the operating system (Citation: laginimaineb-TEE).",https://attack.mitre.org/techniques/T1417/002,T1417.002
