,type,name,Mitigation,url,Tactick_Id
159,attack-pattern,Call Log,"Adversaries may utilize standard operating system APIs to gather call log data. On Android, this can be accomplished using the Call Log Content Provider. iOS provides no standard API to access the call log. 

 

If the device has been jailbroken or rooted, an adversary may be able to access the [Call Log](https://attack.mitre.org/techniques/T1636/002) without the user’s knowledge or approval. ",https://attack.mitre.org/techniques/T1470,T1470
160,attack-pattern,Abuse Accessibility Features,"**This technique has been deprecated. Please use [Input Capture](https://attack.mitre.org/techniques/T1417), [Input Injection](https://attack.mitre.org/techniques/T1516), and [Input Prompt](https://attack.mitre.org/techniques/T1411) where appropriate.**

A malicious app could abuse Android's accessibility features to capture sensitive data or perform other malicious actions.(Citation: Skycure-Accessibility)

Adversaries may abuse accessibility features on Android to emulate a user's clicks, for example to steal money from a user's bank account.(Citation: android-trojan-steals-paypal-2fa)(Citation: banking-trojans-google-play)

Adversaries may abuse accessibility features on Android devices to evade defenses by repeatedly clicking the ""Back"" button when a targeted app manager or mobile security app is launched, or when strings suggesting uninstallation are detected in the foreground. This effectively prevents the malicious application from being uninstalled.(Citation: android-trojan-steals-paypal-2fa)",https://attack.mitre.org/techniques/T1630/001,T1630.001
161,attack-pattern,Web Protocols,"Adversaries may communicate using application layer protocols associated with web protocols traffic to avoid detection/network filtering by blending in with existing traffic. Commands to remote mobile devices, and often the results of those commands, will be embedded within the protocol traffic between the mobile client and server. 

Web protocols such as HTTP and HTTPS are used for web traffic as well as well as notification services native to mobile messaging services such as Google Cloud Messaging (GCM) and newly, Firebase Cloud Messaging (FCM), (GCM/FCM: two-way communication) and Apple Push Notification Service (APNS; one-way server-to-device).  Such notification services leverage HTTP/S via the respective API and are commonly abused on Android and iOS respectively in order blend in with routine device traffic making it difficult for enterprises to inspect. ",https://attack.mitre.org/techniques/T1630,T1630
162,attack-pattern,User Evasion,"Adversaries may attempt to avoid detection by hiding malicious behavior from the user. By doing this, an adversary’s modifications would most likely remain installed on the device for longer, allowing the adversary to continue to operate on that device. 

While there are many ways this can be accomplished, one method is by using the device’s sensors. By utilizing the various motion sensors on a device, such as accelerometer or gyroscope, an application could detect that the device is being interacted with. That way, the application could continue to run while the device is not in use but cease operating while the user is using the device, hiding anything that would indicate malicious activity was ongoing. Accessing the sensors in this way does not require any permissions from the user, so it would be completely transparent.",https://attack.mitre.org/techniques/T1474,T1474
163,attack-pattern,Access Contact List,"An adversary could call standard operating system APIs from a malicious application to gather contact list (i.e., address book) data, or with escalated privileges could directly access files containing contact list data.",https://attack.mitre.org/techniques/T1430/002,T1430.002
164,attack-pattern,Domain Generation Algorithms,"Adversaries may use [Domain Generation Algorithms](https://attack.mitre.org/techniques/T1520) (DGAs) to procedurally generate domain names for command and control communication, and other uses such as malicious application distribution.(Citation: securelist rotexy 2018)

DGAs increase the difficulty for defenders to block, track, or take over the command and control channel, as there potentially could be thousands of domains that malware can check for instructions.",https://attack.mitre.org/techniques/T1636,T1636
165,attack-pattern,Rogue Wi-Fi Access Points,"An adversary could set up unauthorized Wi-Fi access points or compromise existing access points and, if the device connects to them, carry out network-based attacks such as eavesdropping on or modifying network communication(Citation: NIST-SP800153)(Citation: Kaspersky-DarkHotel).",https://attack.mitre.org/techniques/T1521/002,T1521.002
166,attack-pattern,Foreground Persistence,"Adversaries may abuse Android's `startForeground()` API method to maintain continuous sensor access. Beginning in Android 9, idle applications running in the background no longer have access to device sensors, such as the camera, microphone, and gyroscope.(Citation: Android-SensorsOverview) Applications can retain sensor access by running in the foreground, using Android’s `startForeground()` API method. This informs the system that the user is actively interacting with the application, and it should not be killed. The only requirement to start a foreground service is showing a persistent notification to the user.(Citation: Android-ForegroundServices)

Malicious applications may abuse the `startForeground()` API method to continue running in the foreground, while presenting a notification to the user pretending to be a genuine application. This would allow unhindered access to the device’s sensors, assuming permission has been previously granted.(Citation: BlackHat Sutter Android Foreground 2019)

Malicious applications may also abuse the `startForeground()` API to inform the Android system that the user is actively interacting with the application, thus preventing it from being killed by the low memory killer.(Citation: TrendMicro-Yellow Camera)",https://attack.mitre.org/techniques/T1418,T1418
167,attack-pattern,Audio Capture,"Adversaries may capture audio to collect information by leveraging standard operating system APIs of a mobile device. Examples of audio information adversaries may target include user conversations, surroundings, phone calls, or other sensitive information. 

 

Android and iOS, by default, require that applications request device microphone access from the user.  

 

On Android devices, applications must hold the `RECORD_AUDIO` permission to access the microphone or the `CAPTURE_AUDIO_OUTPUT` permission to access audio output. Because Android does not allow third-party applications to hold the `CAPTURE_AUDIO_OUTPUT` permission by default, only privileged applications, such as those distributed by Google or the device vendor, can access audio output.(Citation: Android Permissions) However, adversaries may be able to gain this access after successfully elevating their privileges. With the `CAPTURE_AUDIO_OUTPUT` permission, adversaries may pass the `MediaRecorder.AudioSource.VOICE_CALL` constant to `MediaRecorder.setAudioOutput`, allowing capture of both voice call uplink and downlink.(Citation: Manifest.permission) 

 

On iOS devices, applications must include the `NSMicrophoneUsageDescription` key in their `Info.plist` file to access the microphone.(Citation: Requesting Auth-Media Capture)",https://attack.mitre.org/techniques/T1424,T1424
168,attack-pattern,Unix Shell,"Adversaries may abuse Unix shell commands and scripts for execution. Unix shells are the underlying command prompts on Android and iOS devices. Unix shells can control every aspect of a system, with certain commands requiring elevated privileges that are only accessible if the device has been rooted or jailbroken. 

Unix shells also support scripts that enable sequential execution of commands as well as other typical programming operations such as conditionals and loops. Common uses of shell scripts include long or repetitive tasks, or the need to run the same set of commands on multiple systems. 

Adversaries may abuse Unix shells to execute various commands or payloads. Interactive shells may be accessed through command and control channels or during lateral movement such as with SSH. Adversaries may also leverage shell scripts to deliver and execute multiple commands on victims or as part of payloads used for persistence. 

If the device has been rooted or jailbroken, adversaries may locate and invoke a superuser binary to elevate their privileges and interact with the system as the root user. This dangerous level of permissions allows the adversary to run special commands and modify protected system files.  ",https://attack.mitre.org/techniques/T1636/002,T1636.002
169,attack-pattern,App Delivered via Web Download,,https://attack.mitre.org/techniques/T1418/001,T1418.001
170,attack-pattern,System Checks,"Adversaries may employ various system checks to detect and avoid virtualization and analysis environments. This may include changing behavior after checking for the presence of artifacts indicative of a virtual environment or sandbox. If the adversary detects a virtual environment, they may alter their malware’s behavior to disengage from the victim or conceal the core functions of the implant. They may also search for virtualization artifacts before dropping secondary or additional payloads. 

Checks could include generic system properties such as host/domain name and samples of network traffic. Adversaries may also check the network adapters addresses, CPU core count, and available memory/drive size. 

Hardware checks, such as the presence of motion sensors, could also be used to gather evidence that can be indicative a virtual environment. Adversaries may also query for specific readings from these devices. ",https://attack.mitre.org/techniques/T1631/001,T1631.001
171,attack-pattern,Manipulate App Store Rankings or Ratings,An adversary could use access to a compromised device's credentials to attempt to manipulate app store rankings or ratings by triggering application downloads or posting fake reviews of applications. This technique likely requires privileged access (a rooted or jailbroken device).,https://attack.mitre.org/techniques/T1629,T1629
172,attack-pattern,Geofencing,"Adversaries may use a device’s geographical location to limit certain malicious behaviors. For example, malware operators may limit the distribution of a second stage payload to certain geographic regions.(Citation: Lookout eSurv)

[Geofencing](https://attack.mitre.org/techniques/T1581) is accomplished by persuading the user to grant the application permission to access location services. The application can then collect, process, and exfiltrate the device’s location to perform location-based actions, such as ceasing malicious behavior or showing region-specific advertisements.

One method to accomplish [Geofencing](https://attack.mitre.org/techniques/T1581) on Android is to use the built-in Geofencing API to automatically trigger certain behaviors when the device enters or exits a specified radius around a geographical location. Similar to other [Geofencing](https://attack.mitre.org/techniques/T1581) methods, this requires that the user has granted the `ACCESS_FINE_LOCATION` and `ACCESS_BACKGROUND_LOCATION` permissions. The latter is only required if the application targets Android 10 (API level 29) or higher. However, Android 11 introduced additional permission controls that may restrict background location collection based on user permission choices at runtime. These additional controls include “Allow only while using the app”, which will effectively prohibit background location collection.(Citation: Android Geofencing API)

Similarly, on iOS, developers can use built-in APIs to setup and execute geofencing. Depending on the use case, the app will either need to call `requestWhenInUseAuthorization()` or `requestAlwaysAuthorization()`, depending on when access to the location services is required. Similar to Android, users also have the option to limit when the application can access the device’s location, including one-time use and only when the application is running in the foreground.(Citation: Apple Location Services)

[Geofencing](https://attack.mitre.org/techniques/T1581) can be used to prevent exposure of capabilities in environments that are not intended to be compromised or operated within. For example, location data could be used to limit malware spread and/or capabilities, which could also potentially evade application analysis environments (ex: malware analysis outside of the target geographic area). Other malicious usages could include showing language-specific [Input Prompt](https://attack.mitre.org/techniques/T1411)s and/or advertisements.",https://attack.mitre.org/techniques/T1428,T1428
173,attack-pattern,Remotely Install Application,,https://attack.mitre.org/techniques/T1437/001,T1437.001
174,attack-pattern,Modify Cached Executable Code,"ART (the Android Runtime) compiles optimized code on the device itself to improve performance. An adversary may be able to use escalated privileges to modify the cached code in order to hide malicious behavior. Since the code is compiled on the device, it may not receive the same level of integrity checks that are provided to code running in the system partition.(Citation: Sabanal-ART)",https://attack.mitre.org/techniques/T1635,T1635
175,attack-pattern,Bidirectional Communication,"Adversaries may use an existing, legitimate external Web service channel as a means for sending commands to and receiving output from a compromised system. Compromised systems may leverage popular websites and social media to host command and control (C2) instructions. Those infected systems can then send the output from those commands back over that Web service channel. The return traffic may occur in a variety of ways, depending on the Web service being utilized. For example, the return traffic may take the form of the compromised system posting a comment on a forum, issuing a pull request to development project, updating a document hosted on a Web service, or by sending a Tweet. 

 

Popular websites and social media, acting as a mechanism for C2, may give a significant amount of cover. This is due to the likelihood that hosts within a network are already communicating with them prior to a compromise. Using common services, such as those offered by Google or Twitter, makes it easier for adversaries to hide in expected noise. Web service providers commonly use SSL/TLS encryption, giving adversaries an added level of protection. ",https://attack.mitre.org/techniques/T1628/002,T1628.002
176,attack-pattern,Non-Standard Port,"Adversaries may generate network traffic using a protocol and port paring that are typically not associated. For example, HTTPS over port 8088 or port 587 as opposed to the traditional port 443. Adversaries may make changes to the standard port used by a protocol to bypass filtering or muddle analysis/parsing of network data.",https://attack.mitre.org/techniques/T1633,T1633
177,attack-pattern,Compromise Software Supply Chain,"Adversaries may manipulate application software prior to receipt by a final consumer for the purpose of data or system compromise. Supply chain compromise of software can take place in a number of ways, including manipulation of the application source code, manipulation of the update/distribution mechanism for that software, or replacing compiled releases with a modified version.",https://attack.mitre.org/techniques/T1579,T1579
178,attack-pattern,Device Lockout,"An adversary may seek to lock the legitimate user out of the device, for example to inhibit user interaction or to obtain a ransom payment.

On Android versions prior to 7, apps can abuse Device Administrator access to reset the device lock passcode to prevent the user from unlocking the device. After Android 7, only device or profile owners (e.g. MDMs) can reset the device’s passcode.(Citation: Android resetPassword)

On iOS devices, this technique does not work because mobile device management servers can only remove the screen lock passcode, they cannot set a new passcode. However, on jailbroken devices, malware has been discovered that can lock the user out of the device.(Citation: Xiao-KeyRaider)",https://attack.mitre.org/techniques/T1413,T1413
179,attack-pattern,Stolen Developer Credentials or Signing Keys,,https://attack.mitre.org/techniques/T1623,T1623
180,attack-pattern,SIM Card Swap,"An adversary could convince the mobile network operator (e.g. through social networking, forged identification, or insider attacks performed by trusted employees) to issue a new SIM card and associate it with an existing phone number and account.(Citation: NYGov-Simswap)(Citation: Motherboard-Simswap2) The adversary could then obtain SMS messages or hijack phone calls intended for someone else.(Citation: Betanews-Simswap)

One use case is intercepting authentication messages or phone calls to obtain illicit access to online banking or other online accounts, as many online services allow account password resets by sending an authentication code over SMS to a phone number associated with the account.(Citation: Guardian-Simswap)(Citation: Motherboard-Simswap1)(Citation: Krebs-SimSwap)(Citation: TechCrunch-SimSwap)",https://attack.mitre.org/techniques/T1629/003,T1629.003
181,attack-pattern,Input Capture,"Adversaries may use methods of capturing user input to obtain credentials or collect information. During normal device usage, users often provide credentials to various locations, such as login pages/portals or system dialog boxes. Input capture mechanisms may be transparent to the user (e.g. [Keylogging](https://attack.mitre.org/techniques/T1417/001)) or rely on deceiving the user into providing input into what they believe to be a genuine application prompt (e.g. [GUI Input Capture](https://attack.mitre.org/techniques/T1417/002)).",https://attack.mitre.org/techniques/T1544,T1544
182,attack-pattern,Generate Traffic from Victim,"Adversaries may generate outbound traffic from devices. This is typically performed to manipulate external outcomes, such as to achieve carrier billing fraud or to manipulate app store rankings or ratings. Outbound traffic is typically generated as SMS messages or general web traffic, but may take other forms as well.

If done via SMS messages, Android apps must hold the `SEND_SMS` permission. Additionally, sending an SMS message requires user consent if the recipient is a premium number. Applications cannot send SMS messages on iOS",https://attack.mitre.org/techniques/T1637,T1637
183,attack-pattern,Masquerade as Legitimate Application,"An adversary could distribute developed malware by masquerading the malware as a legitimate application. This can be done in two different ways: by embedding the malware in a legitimate application, or by pretending to be a legitimate application.

Embedding the malware in a legitimate application is done by downloading the application, disassembling it, adding the malicious code, and then re-assembling it.(Citation: Zhou) The app would appear to be the original app, but would contain additional malicious functionality. The adversary could then publish the malicious application to app stores or use another delivery method.

Pretending to be a legitimate application relies heavily on lack of scrutinization by the user. Typically, a malicious app pretending to be a legitimate one will have many similar details as the legitimate one, such as name, icon, and description.(Citation: Palo Alto HenBox)

Malicious applications may also masquerade as legitimate applications when requesting access to the accessibility service in order to appear as legitimate to the user, increasing the likelihood that the access will be granted.",https://attack.mitre.org/techniques/T1477,T1477
184,attack-pattern,SMS Control,"Adversaries may delete, alter, or send SMS messages without user authorization. This could be used to hide C2 SMS messages, spread malware, or various external effects.

This can be accomplished by requesting the `RECEIVE_SMS` or `SEND_SMS` permissions depending on what the malware is attempting to do. If the app is set as the default SMS handler on the device, the `SMS_DELIVER` broadcast intent can be registered, which allows the app to write to the SMS content provider. The content provider directly modifies the messaging database on the device, which could allow malicious applications with this ability to insert, modify, or delete arbitrary messages on the device.(Citation: SMS KitKat)(Citation: Android SmsProvider)",https://attack.mitre.org/techniques/T1423,T1423
185,attack-pattern,Disguise Root/Jailbreak Indicators,"An adversary could use knowledge of the techniques used by security software to evade detection(Citation: Brodie)(Citation: Tan). For example, some mobile security products perform compromised device detection by searching for particular artifacts such as an installed ""su"" binary, but that check could be evaded by naming the binary something else. Similarly, polymorphic code techniques could be used to evade signature-based detection(Citation: Rastogi).",https://attack.mitre.org/techniques/T1618,T1618
186,attack-pattern,Exfiltration Over Other Network Medium,"Adversaries may attempt to exfiltrate data over a different network medium than the command and control channel. If the command and control network is a standard Internet connection, the exfiltration may occur, for example, via Bluetooth, or another radio frequency (RF) channel. 

Adversaries may choose to do this if they have sufficient access or proximity, and the connection might not be secured or defended as well as the primary Internet-connected channel because it is not routed through the same enterprise network. ",https://attack.mitre.org/techniques/T1646,T1646
187,attack-pattern,Process Injection,"Adversaries may inject code into processes in order to evade process-based defenses or even elevate privileges. Process injection is a method of executing arbitrary code in the address space of a separate live process. Running code in the context of another process may allow access to the process's memory, system/network resources, and possibly elevated privileges. Execution via process injection may also evade detection from security products since the execution is masked under a legitimate process. 

Both Android and iOS have no legitimate way to achieve process injection. The only way this is possible is by abusing existing root access or exploiting a vulnerability.",https://attack.mitre.org/techniques/T1404,T1404
188,attack-pattern,SMS Messages,"Adversaries may utilize standard operating system APIs to gather SMS messages. On Android, this can be accomplished using the SMS Content Provider. iOS provides no standard API to access SMS messages. 

If the device has been jailbroken or rooted, an adversary may be able to access [SMS Messages](https://attack.mitre.org/techniques/T1636/004) without the user’s knowledge or approval. ",https://attack.mitre.org/techniques/T1639/001,T1639.001
189,attack-pattern,System Runtime API Hijacking,"Adversaries may execute their own malicious payloads by hijacking the way an operating system run applications. Hijacking execution flow can be for the purposes of persistence since this hijacked execution may reoccur at later points in time. 


On Android, adversaries may overwrite the standard OS API library with a malicious alternative to hook into core functions to achieve persistence. By doing this, the adversary’s code will be executed every time the overwritten API function is called by an app on the infected device.",https://attack.mitre.org/techniques/T1624/001,T1624.001
190,attack-pattern,Credentials from Password Store,"Adversaries may search common password storage locations to obtain user credentials. Passwords can be stored in several places on a device, depending on the operating system or application holding the credentials. There are also specific applications that store passwords to make it easier for users manage and maintain. Once credentials are obtained, they can be used to perform lateral movement and access restricted information.",https://attack.mitre.org/techniques/T1436,T1436
191,attack-pattern,Hooking,"Adversaries may utilize hooking to hide the presence of artifacts associated with their behaviors to evade detection. Hooking can be used to modify return values or data structures of system APIs and function calls. This process typically involves using 3rd party root frameworks, such as Xposed or Magisk, with either a system exploit or pre-existing root access. By including custom modules for root frameworks, adversaries can hook system APIs and alter the return value and/or system data structures to alter functionality/visibility of various aspects of the system.",https://attack.mitre.org/techniques/T1439,T1439
