,type,name,Mitigation,url,Tactick_Id
492,attack-pattern,Suppress Application Icon,"A malicious application could suppress its icon from being displayed to the user in the application launcher. This hides the fact that it is installed, and can make it more difficult for the user to uninstall the application. Hiding the application's icon programmatically does not require any special permissions. 

This behavior has been seen in the BankBot/Spy Banker family of malware.(Citation: android-trojan-steals-paypal-2fa)(Citation: sunny-stolen-credentials)(Citation: bankbot-spybanker) 

Beginning in Android 10, changes were introduced to inhibit malicious applications’ ability to hide their icon. If an app is a system app, requests no permissions, or does not have a launcher activity, the application’s icon will be fully hidden. Further, if the device is fully managed or the application is in a work profile, the icon will be fully hidden. Otherwise, a synthesized activity is shown, which is a launcher icon that represents the app’s details page in the system settings. If the user clicks the synthesized activity in the launcher, they are taken to the application’s details page in the system settings.(Citation: Android 10 Limitations to Hiding App Icons)(Citation: LauncherApps getActivityList)",https://attack.mitre.org/techniques/T1417/002,T1417.002
493,attack-pattern,Drive-By Compromise,"Adversaries may gain access to a system through a user visiting a website over the normal course of browsing. With this technique, the user's web browser is typically targeted for exploitation, but adversaries may also use compromised websites for non-exploitation behavior such as acquiring an [Application Access Token](https://attack.mitre.org/techniques/T1550/001).

Multiple ways of delivering exploit code to a browser exist, including:

* A legitimate website is compromised where adversaries have injected some form of malicious code such as JavaScript, iFrames, and cross-site scripting.
* Malicious ads are paid for and served through legitimate ad providers.
* Built-in web application interfaces are leveraged for the insertion of any other kind of object that can be used to display web content or contain a script that executes on the visiting client (e.g. forum posts, comments, and other user controllable web content).

Often the website used by an adversary is one visited by a specific community, such as government, a particular industry, or region, where the goal is to compromise a specific user or set of users based on a shared interest. This kind of targeted attack is referred to a strategic web compromise or watering hole attack. There are several known examples of this occurring.(Citation: Lookout-StealthMango)

Typical drive-by compromise process:

1. A user visits a website that is used to host the adversary controlled content.
2. Scripts automatically execute, typically searching versions of the browser and plugins for a potentially vulnerable version. 
    * The user may be required to assist in this process by enabling scripting or active website components and ignoring warning dialog boxes.
3. Upon finding a vulnerable version, exploit code is delivered to the browser.
4. If exploitation is successful, then it will give the adversary code execution on the user's system unless other protections are in place.
    * In some cases a second visit to the website after the initial scan is required before exploit code is delivered.",https://attack.mitre.org/techniques/T1432,T1432
494,course-of-action,Application Developer Guidance,This mitigation describes any guidance or training given to developers of applications to avoid introducing security weaknesses that an adversary may be able to take advantage of.,https://attack.mitre.org/techniques/T1406/002,T1406.002
495,course-of-action,User Guidance,Describes any guidance or training given to users to set particular configuration settings or avoid specific potentially risky behaviors.,https://attack.mitre.org/techniques/T1450,T1450
496,course-of-action,Caution with Device Administrator Access,"Warn device users not to accept requests to grant Device Administrator access to applications without good reason.

Additionally, application vetting should include a check on whether the application requests Device Administrator access. Applications that do request Device Administrator access should be carefully scrutinized and only allowed to be used if a valid reason exists.",https://attack.mitre.org/techniques/T1575,T1575
497,attack-pattern,Adversary-in-the-Middle,"Adversaries may attempt to position themselves between two or more networked devices to support follow-on behaviors such as [Transmitted Data Manipulation](https://attack.mitre.org/techniques/T1565/002) or [Endpoint Denial of Service](https://attack.mitre.org/techniques/T1642).  

 

[Adversary-in-the-Middle](https://attack.mitre.org/techniques/T1638) can be achieved through several mechanisms. For example, a malicious application may register itself as a VPN client, effectively redirecting device traffic to adversary-owned resources. Registering as a VPN client requires user consent on both Android and iOS; additionally, a special entitlement granted by Apple is needed for iOS devices. Alternatively, a malicious application with escalation privileges may utilize those privileges to gain access to network traffic.   


 Specific to Android devices, adversary-in-the-disk is a type of AiTM attack where adversaries monitor and manipulate data that is exchanged between applications and external storage.(Citation: mitd_kaspersky)(Citation: mitd_checkpoint)(Citation: mitd_checkpoint_research) To accomplish this, a malicious application firsts requests for access to multimedia files on the device (`READ_EXTERNAL STORAGE` and `WRITE_EXTERNAL_STORAGE`), then the application reads data on the device and/or writes malware to the device. Though the request for access is common, when used maliciously, adversaries may access files and other sensitive data due to abusing the permission. Multiple applications were shown to be vulnerable against this attack; however, scrutiny of permissions and input validations may mitigate this attack.    

Outside of a mobile device, adversaries may be able to capture traffic by employing a rogue base station or Wi-Fi access point. These devices will allow adversaries to capture network traffic after it has left the device, while it is flowing to its destination. On a local network, enterprise techniques could be used, such as [ARP Cache Poisoning](https://attack.mitre.org/techniques/T1557/002) or [DHCP Spoofing](https://attack.mitre.org/techniques/T1557/003).  

 

If applications properly encrypt their network traffic, sensitive data may not be accessible to adversaries, depending on the point of capture. For example, properly implementing Apple’s Application Transport Security (ATS) and Android’s Network Security Configuration (NSC) may prevent sensitive data leaks.(Citation: NSC_Android)",https://attack.mitre.org/techniques/T1540,T1540
498,attack-pattern,Obtain Device Cloud Backups,"An adversary who is able to obtain unauthorized access to or misuse authorized access to cloud backup services (e.g. Google's Android backup service or Apple's iCloud) could use that access to obtain sensitive data stored in device backups. For example, the Elcomsoft Phone Breaker product advertises the ability to retrieve iOS backup data from Apple's iCloud (Citation: Elcomsoft-EPPB). Elcomsoft also describes (Citation: Elcomsoft-WhatsApp) obtaining WhatsApp communication histories from backups stored in iCloud.",https://attack.mitre.org/techniques/T1638,T1638
499,attack-pattern,Process Discovery,"Adversaries may attempt to get information about running processes on a device. Information obtained could be used to gain an understanding of common software/applications running on devices within a network. Adversaries may use the information from [Process Discovery](https://attack.mitre.org/techniques/T1424) during automated discovery to shape follow-on behaviors, including whether or not the adversary fully infects the target and/or attempts specific actions. 

 

Recent Android security enhancements have made it more difficult to obtain a list of running processes. On Android 7 and later, there is no way for an application to obtain the process list without abusing elevated privileges. This is due to the Android kernel utilizing the `hidepid` mount feature. Prior to Android 7, applications could utilize the `ps` command or examine the `/proc` directory on the device.(Citation: Android-SELinuxChanges) 

 

In iOS, applications have previously been able to use the `sysctl` command to obtain a list of running processes. This functionality has been removed in later iOS versions. ",https://attack.mitre.org/techniques/T1626,T1626
500,attack-pattern,Security Software Discovery,"Adversaries may attempt to get a listing of security applications and configurations that are installed on a device. This may include things such as mobile security products. Adversaries may use the information from [Security Software Discovery](https://attack.mitre.org/techniques/T1418/001) during automated discovery to shape follow-on behaviors, including whether or not to fully infect the target and/or attempt specific actions. ",https://attack.mitre.org/techniques/T1663,T1663
501,attack-pattern,Ptrace System Calls,"Adversaries may inject malicious code into processes via ptrace (process trace) system calls in order to evade process-based defenses as well as possibly elevate privileges. Ptrace system call injection is a method of executing arbitrary code in the address space of a separate live process.  

Ptrace system call injection involves attaching to and modifying a running process. The ptrace system call enables a debugging process to observe and control another process (and each individual thread), including changing memory and register values.(Citation: PTRACE man) Ptrace system call injection is commonly performed by writing arbitrary code into a running process (e.g., by using `malloc`) then invoking that memory with `PTRACE_SETREGS` to set the register containing the next instruction to execute. Ptrace system call injection can also be done with `PTRACE_POKETEXT`/`PTRACE_POKEDATA`, which copy data to a specific address in the target process's memory (e.g., the current address of the next instruction).(Citation: PTRACE man)(Citation: Medium Ptrace JUL 2018)  

Ptrace system call injection may not be possible when targeting processes with high-privileges, and on some systems those that are non-child processes.(Citation: BH Linux Inject)  

Running code in the context of another process may allow access to the process's memory, system/network resources, and possibly elevated privileges. Execution via ptrace system call injection may also evade detection from security products since the execution is masked under a legitimate process.",https://attack.mitre.org/techniques/T1470,T1470
502,attack-pattern,Steal Application Access Token,"Adversaries can steal user application access tokens as a means of acquiring credentials to access remote systems and resources. This can occur through social engineering or URI hijacking and typically requires user action to grant access, such as through a system “Open With” dialogue.  

Application access tokens are used to make authorized API requests on behalf of a user and are commonly used as a way to access resources in cloud-based applications and software-as-a-service (SaaS).(Citation: Auth0 - Why You Should Always Use Access Tokens to Secure APIs Sept 2019) OAuth is one commonly implemented framework used to issue tokens to users for access to systems. An application desiring access to cloud-based services or protected APIs can gain entry through OAuth 2.0 using a variety of authorization protocols. An example of a commonly-used sequence is Microsoft's Authorization Code Grant flow.(Citation: Microsoft Identity Platform Protocols May 2019)(Citation: Microsoft - OAuth Code Authorization flow - June 2019) An OAuth access token enables a third-party application to interact with resources containing user data in the ways requested without requiring user credentials.",https://attack.mitre.org/techniques/T1630/001,T1630.001
503,attack-pattern,Virtualization/Sandbox Evasion,"Adversaries may employ various means to detect and avoid virtualization and analysis environments. This may include changing behaviors after checking for the presence of artifacts indicative of a virtual machine environment (VME) or sandbox. If the adversary detects a VME, they may alter their malware’s behavior to disengage from the victim or conceal the core functions of the payload. They may also search for VME artifacts before dropping further payloads. Adversaries may use the information learned from [Virtualization/Sandbox Evasion](https://attack.mitre.org/techniques/T1633) during automated discovery to shape follow-on behaviors. 

Adversaries may use several methods to accomplish [Virtualization/Sandbox Evasion](https://attack.mitre.org/techniques/T1633) such as checking for system artifacts associated with analysis or virtualization. Adversaries may also check for legitimate user activity to help determine if it is in an analysis environment. ",https://attack.mitre.org/techniques/T1630,T1630
504,attack-pattern,Application Versioning,"An adversary may push an update to a previously benign application to add malicious code. This can be accomplished by pushing an initially benign, functional application to a trusted application store, such as the Google Play Store or the Apple App Store. This allows the adversary to establish a trusted userbase that may grant permissions to the application prior to the introduction of malicious code. Then, an application update could be pushed to introduce malicious code.(Citation: android_app_breaking_bad)

This technique could also be accomplished by compromising a developer’s account. This would allow an adversary to take advantage of an existing userbase without having to establish the userbase themselves. ",https://attack.mitre.org/techniques/T1474,T1474
505,attack-pattern,Compromise Client Software Binary,"Adversaries may modify system software binaries to establish persistent access to devices. System software binaries are used by the underlying operating system and users over adb or terminal emulators. 

Adversaries may make modifications to client software binaries to carry out malicious tasks when those binaries are executed. For example, malware may come with a pre-compiled malicious binary intended to overwrite the genuine one on the device. Since these binaries may be routinely executed by the system or user, the adversary can leverage this for persistent access to the device. ",https://attack.mitre.org/techniques/T1430/002,T1430.002
506,attack-pattern,Proxy Through Victim,"Adversaries may use a compromised device as a proxy server to the Internet. By utilizing a proxy, adversaries hide the true IP address of their C2 server and associated infrastructure from the destination of the network traffic. This masquerades an adversary’s traffic as legitimate traffic originating from the compromised device, which can evade IP-based restrictions and alerts on certain services, such as bank accounts and social media websites.(Citation: Threat Fabric Exobot)

The most common type of proxy is a SOCKS proxy. It can typically be implemented using standard OS-level APIs and 3rd party libraries with no indication to the user. On Android, adversaries can use the `Proxy` API to programmatically establish a SOCKS proxy connection, or lower-level APIs to interact directly with raw sockets.",https://attack.mitre.org/techniques/T1655/001,T1655.001
507,attack-pattern,Foreground Persistence,"Adversaries may abuse Android's `startForeground()` API method to maintain continuous sensor access. Beginning in Android 9, idle applications running in the background no longer have access to device sensors, such as the camera, microphone, and gyroscope.(Citation: Android-SensorsOverview) Applications can retain sensor access by running in the foreground, using Android’s `startForeground()` API method. This informs the system that the user is actively interacting with the application, and it should not be killed. The only requirement to start a foreground service is showing a persistent notification to the user.(Citation: Android-ForegroundServices)

Malicious applications may abuse the `startForeground()` API method to continue running in the foreground, while presenting a notification to the user pretending to be a genuine application. This would allow unhindered access to the device’s sensors, assuming permission has been previously granted.(Citation: BlackHat Sutter Android Foreground 2019)

Malicious applications may also abuse the `startForeground()` API to inform the Android system that the user is actively interacting with the application, thus preventing it from being killed by the low memory killer.(Citation: TrendMicro-Yellow Camera)",https://attack.mitre.org/techniques/T1636,T1636
508,attack-pattern,Audio Capture,"Adversaries may capture audio to collect information by leveraging standard operating system APIs of a mobile device. Examples of audio information adversaries may target include user conversations, surroundings, phone calls, or other sensitive information. 

 

Android and iOS, by default, require that applications request device microphone access from the user.  

 

On Android devices, applications must hold the `RECORD_AUDIO` permission to access the microphone or the `CAPTURE_AUDIO_OUTPUT` permission to access audio output. Because Android does not allow third-party applications to hold the `CAPTURE_AUDIO_OUTPUT` permission by default, only privileged applications, such as those distributed by Google or the device vendor, can access audio output.(Citation: Android Permissions) However, adversaries may be able to gain this access after successfully elevating their privileges. With the `CAPTURE_AUDIO_OUTPUT` permission, adversaries may pass the `MediaRecorder.AudioSource.VOICE_CALL` constant to `MediaRecorder.setAudioOutput`, allowing capture of both voice call uplink and downlink.(Citation: Manifest.permission) 

 

On iOS devices, applications must include the `NSMicrophoneUsageDescription` key in their `Info.plist` file to access the microphone.(Citation: Requesting Auth-Media Capture)",https://attack.mitre.org/techniques/T1521/002,T1521.002
509,attack-pattern,Hijack Execution Flow,"Adversaries may execute their own malicious payloads by hijacking the way operating systems run applications. Hijacking execution flow can be for the purposes of persistence since this hijacked execution may reoccur over time. 

There are many ways an adversary may hijack the flow of execution. A primary way is by manipulating how the operating system locates programs to be executed. How the operating system locates libraries to be used by a program can also be intercepted. Locations where the operating system looks for programs or resources, such as file directories, could also be poisoned to include malicious payloads.",https://attack.mitre.org/techniques/T1418,T1418
510,attack-pattern,Application Layer Protocol,"Adversaries may communicate using application layer protocols to avoid detection/network filtering by blending in with existing traffic. Commands to the mobile device, and often the results of those commands, will be embedded within the protocol traffic between the mobile device and server. 

Adversaries may utilize many different protocols, including those used for web browsing, transferring files, electronic mail, or DNS.",https://attack.mitre.org/techniques/T1424,T1424
511,attack-pattern,Download New Code at Runtime,"Adversaries may download and execute dynamic code not included in the original application package after installation. This technique is primarily used to evade static analysis checks and pre-publication scans in official app stores. In some cases, more advanced dynamic or behavioral analysis techniques could detect this behavior. However, in conjunction with [Execution Guardrails](https://attack.mitre.org/techniques/T1627) techniques, detecting malicious code downloaded after installation could be difficult.

On Android, dynamic code could include native code, Dalvik code, or JavaScript code that utilizes Android WebView’s `JavascriptInterface` capability. 

On iOS, dynamic code could be downloaded and executed through 3rd party libraries such as JSPatch. (Citation: FireEye-JSPatch) ",https://attack.mitre.org/techniques/T1636/002,T1636.002
512,attack-pattern,Remotely Track Device Without Authorization,An adversary who is able to obtain unauthorized access to or misuse authorized access to cloud services (e.g. Google's Android Device Manager or Apple iCloud's Find my iPhone) or to an enterprise mobility management (EMM) / mobile device management (MDM) server console could use that access to track mobile devices.(Citation: Krebs-Location),https://attack.mitre.org/techniques/T1418/001,T1418.001
513,attack-pattern,Screen Capture,"Adversaries may use screen capture to collect additional information about a target device, such as applications running in the foreground, user data, credentials, or other sensitive information. Applications running in the background can capture screenshots or videos of another application running in the foreground by using the Android `MediaProjectionManager` (generally requires the device user to grant consent).(Citation: Fortinet screencap July 2019)(Citation: Android ScreenCap1 2019) Background applications can also use Android accessibility services to capture screen contents being displayed by a foreground application.(Citation: Lookout-Monokle) An adversary with root access or Android Debug Bridge (adb) access could call the Android `screencap` or `screenrecord` commands.(Citation: Android ScreenCap2 2019)(Citation: Trend Micro ScreenCap July 2015) ",https://attack.mitre.org/techniques/T1631/001,T1631.001
514,attack-pattern,Compromise Software Dependencies and Development Tools,Adversaries may manipulate products or product delivery mechanisms prior to receipt by a final consumer for the purpose of data or system compromise. Applications often depend on external software to function properly. Popular open source projects that are used as dependencies in many applications may be targeted as a means to add malicious code to users of the dependency.(Citation: Grace-Advertisement),https://attack.mitre.org/techniques/T1629,T1629
515,attack-pattern,Remotely Install Application,,https://attack.mitre.org/techniques/T1428,T1428
516,attack-pattern,Modify Cached Executable Code,"ART (the Android Runtime) compiles optimized code on the device itself to improve performance. An adversary may be able to use escalated privileges to modify the cached code in order to hide malicious behavior. Since the code is compiled on the device, it may not receive the same level of integrity checks that are provided to code running in the system partition.(Citation: Sabanal-ART)",https://attack.mitre.org/techniques/T1437/001,T1437.001
517,attack-pattern,Uninstall Malicious Application,"Adversaries may include functionality in malware that uninstalls the malicious application from the device. This can be achieved by:

* Abusing device owner permissions to perform silent uninstallation using device owner API calls.
* Abusing root permissions to delete files from the filesystem.
* Abusing the accessibility service. This requires an intent be sent to the system to request uninstallation, and then abusing the accessibility service to click the proper places on the screen to confirm uninstallation.",https://attack.mitre.org/techniques/T1635,T1635
518,attack-pattern,Compromise Software Supply Chain,"Adversaries may manipulate application software prior to receipt by a final consumer for the purpose of data or system compromise. Supply chain compromise of software can take place in a number of ways, including manipulation of the application source code, manipulation of the update/distribution mechanism for that software, or replacing compiled releases with a modified version.",https://attack.mitre.org/techniques/T1628/002,T1628.002
519,attack-pattern,Dead Drop Resolver,"Adversaries may use an existing, legitimate external Web service to host information that points to additional command and control (C2) infrastructure. Adversaries may post content, known as a dead drop resolver, on Web services with embedded (and often obfuscated/encoded) domains or IP addresses. Once infected, victims will reach out to and be redirected by these resolvers. 

 

Popular websites and social media, acting as a mechanism for C2, may give a significant amount of cover. This is due to the likelihood that hosts within a network are already communicating with them prior to a compromise. Using common services, such as those offered by Google or Twitter, makes it easier for adversaries to hide in expected noise. Web service providers commonly use SSL/TLS encryption, giving adversaries an added level of protection. 

 

Use of a dead drop resolver may also protect back-end C2 infrastructure from discovery through malware binary analysis, or enable operational resiliency (since this infrastructure may be dynamically changed). ",https://attack.mitre.org/techniques/T1633,T1633
